word,word_type,chunked_sentence,masked_chunked_sentence,example_sentence,masked_example_sentence,openai_sentence,masked_openai_sentence
from,3_science_LS1,awad crows can plants move from one place to another,Awad crows can plants move **** one place to another,"`` These actions should serve to protect in fact and in effect the court's wards from undue costs and its appointed and elected servants from unmeritorious criticisms '' , the jury said .","`` these actions should serve to protect in fact and in effect the court's wards **** undue costs and its appointed and elected servants **** unmeritorious criticisms '' , the jury said .",This gift is from my mom.,This gift is **** my mom.
protection,3_science_LS1,the basic safety needs and protection of birds how do,The basic safety needs and ********** of birds how do,"Under the circumstances , the only protection for the relatively small manufacturers is to engage in exactly the kind of conspiracy with the giants for which the latter were convicted .","Under the circumstances , the only ********** for the relatively small manufacturers is to engage in exactly the kind of conspiracy with the giants for which the latter were convicted .",Wear sunscreen for protection.,Wear sunscreen for **********.
touch,3_science_LS1,creative efunduguru we do not touch ourselves in these parts,Creative efunduguru we do not ***** ourselves in these parts,"As usual , he made no attempt to get in touch with Carmine G. De Sapio , the Manhattan leader .","As usual , he made no attempt to get in ***** with carmine g. de sapio , the manhattan leader .",Don't touch the wet paint.,Don't ***** the wet paint.
raise,3_science_LS1,to find food and to raise thew young ones,To find food and to ***** thew young ones,"The new fees are expected to raise an additional $740,000 in the remainder of 1961 and $2,330,000 more a year after that .","The new fees are expected to ***** an additional $740,000 in the remainder of 1961 and $2,330,000 more a year after that .",Raise your hand to speak.,***** your hand to speak.
response,3_science_LS1,understand movement comprehension questions understand response to stimuli hots list,Understand movement comprehension questions understand ******** to stimuli hots list,But thus far there has been no response in kind .,But thus far there has been no ******** in kind .,His response was very quick.,His ******** was very quick.
breakdown,3_science_LS1,this breakdown of food mouth happens,This ********* of food mouth happens,"The report called racial discrimination in employment `` one of the most serious causes of family breakdown , desertion , and ADC dependency '' .","The report called racial discrimination in employment `` one of the most serious causes of family ********* , desertion , and adc dependency '' .", Dad had a breakdown of the car's cost., dad had a ********* of the car's cost.
ways,3_science_LS1,to create leaf art and ways of read and answer,To create leaf art and **** of read and answer,"`` He calls for help while saying he is against centralization , but you can't have it both ways '' , Jones said .","`` he calls for help while saying he is against centralization , but you can't have it both **** '' , jones said .",There are many ways to solve this.,There are many **** to solve this.
word,3_science_LS1,frutt 1 prccaovana ery the word arimal comes bom 2,Frutt 1 prccaovana ery the **** arimal comes bom 2,"As of Sunday night , there was no word of a resolution being offered there to rescind the action .","As of sunday night , there was no **** of a resolution being offered there to rescind the action .",openai_sentence,masked_openai_sentence
word,3_science_LS1,frutt 1 prccaovana ery the word arimal comes bom 2,Frutt 1 prccaovana ery the **** arimal comes bom 2,"As of Sunday night , there was no word of a resolution being offered there to rescind the action .","As of sunday night , there was no **** of a resolution being offered there to rescind the action .",Learn a new word.,masked_openai_sentence
computer,3_science_LS1,atin fe lftentity parti ofa computer golveaa pillin the blanks,Atin fe lftentity parti ofa ******** golveaa pillin the blanks,"Outputs of the two systems are measured by a pulse-timing circuit and a resistance bridge , followed by a simple analogue computer which feeds a multichannel recorder .","Outputs of the two systems are measured by a pulse-timing circuit and a resistance bridge , followed by a simple analogue ******** which feeds a multichannel recorder .",I play games on my computer.,I play games on my ********.
swimming,3_science_LS1,playing outdoors cycling and swimming are some good forms,Playing outdoors cycling and ******** are some good forms,Innumerable motels from Tucson to New York boast swimming pools ( `` swim at your own risk '' is the hospitable sign poised at the brink of most pools ) .,Innumerable motels from tucson to new york boast ******** pools ( `` swim at your own risk '' is the hospitable sign poised at the brink of most pools ) ., Swimming is fun in summer., ******** is fun in summer.
than,3_science_LS1,heart is a little larger than the size of your,Heart is a little larger **** the size of your,The petition said that the couple has not lived together as man and wife for more than a year .,The petition said that the couple has not lived together as man and wife for more **** a year .,Apples are sweeter than lemons.,Apples are sweeter **** lemons.
simple,3_science_LS1,questions and makes predictions about simple pattems such as flowers,Questions and makes predictions about ****** pattems such as flowers,"Ah , that is simple .","Ah , that is ****** .",Math is simple for me.,Math is ****** for me.
covered,3_science_LS1,the frame is covered by coloured pieces of,The frame is ******* by coloured pieces of,-- President Kennedy today proposed a mammoth new medical care program whereby social security taxes on 70 million American workers would be raised to pay the hospital and some other medical bills of 14.2 million Americans over 65 who are covered by social security or railroad retirement programs .,-- president kennedy today proposed a mammoth new medical care program whereby social security taxes on 70 million american workers would be raised to pay the hospital and some other medical bills of 14.2 million americans over 65 who are ******* by social security or railroad retirement programs .,The car is covered with snow.,The car is ******* with snow.
breathe,3_science_LS1,modes lifecycle discuss how insects breathe fill in the blanks,Modes lifecycle discuss how insects ******* fill in the blanks,"Such a twist would be a tragedy for the Dominican people , who deserve to breathe without fear .","Such a twist would be a tragedy for the dominican people , who deserve to ******* without fear .",Fish breathe underwater.,Fish ******* underwater.
customs,3_science_LS1,of te in heritage traditions customs and strong ethics ea,Of te in heritage traditions ******* and strong ethics ea,"Eighteenth-century England , upon whose customs our common law was built , had outlawed unions as monopolies and conspiracies .","Eighteenth-century england , upon whose ******* our common law was built , had outlawed unions as monopolies and conspiracies .", We learned about different customs in school., we learned about different ******* in school.
learn,3_science_LS1,let us learn about the human body,Let us ***** about the human body,"The impression has nevertheless been given during these three days , despite Mr. Rusk's personal popularity , that the United States delegation came to Oslo in a somewhat tentative and exploratory frame of mind , more ready to listen and learn than to enunciate firm policy on a global scale with detailed application to individual danger spots .","The impression has nevertheless been given during these three days , despite mr. rusk's personal popularity , that the united states delegation came to oslo in a somewhat tentative and exploratory frame of mind , more ready to listen and ***** than to enunciate firm policy on a global scale with detailed application to individual danger spots .",I learn new words every day.,I ***** new words every day.
seed,3_science_LS1,know the functions of a seed oe te ce do,Know the functions of a **** oe te ce do,"The firm is prominent in making equipment for cleaning seed cotton , driers , and heaters , and they lay claim to being the first maker ( 1910 ) of boil extraction equipment .","The firm is prominent in making equipment for cleaning **** cotton , driers , and heaters , and they lay claim to being the first maker ( 1910 ) of boil extraction equipment .",Plant the seed in the soil.,Plant the **** in the soil.
repair,3_science_LS1,needs vitamins and mii a repair the damaged parts,Needs vitamins and mii a ****** the damaged parts,"The bond issue will go to the state courts for a friendly test suit to test the validity of the act , and then the sales will begin and contracts let for repair work on some of Georgia's most heavily traveled highways .","The bond issue will go to the state courts for a friendly test suit to test the validity of the act , and then the sales will begin and contracts let for ****** work on some of georgia's most heavily traveled highways .",We repair broken toys.,We ****** broken toys.
contract,3_science_LS1,muscles expand and contract and help us in,Muscles expand and ******** and help us in,"The city has sued for the full amount of the $172,400 performance bond covering the contract .","The city has sued for the full amount of the $172,400 performance bond covering the ******** .",Sign the contract for the house.,Sign the ******** for the house.
smartly,3_science_LS1,approach to education altura combines smartly designed learning resources that,Approach to education altura combines ******* designed learning resources that,"The sight of sleek inboards , outboards , and sailboats being wheeled smartly along highways many miles from any water is commonplace .","The sight of sleek inboards , outboards , and sailboats being wheeled ******* along highways many miles from any water is commonplace .", He dressed smartly for the interview., he dressed ******* for the interview.
cone,3_science_LS1,stage chapter ke currioutat compotoncion cone ote warmupaativity talk exercises,Stage chapter ke currioutat compotoncion **** ote warmupaativity talk exercises,"Clerfayt , driving , sees himself `` a volcano whose cone funneled down to hell '' ; ;","Clerfayt , driving , sees himself `` a volcano whose **** funneled down to hell '' ; ;",Ice cream comes in a cone.,Ice cream comes in a ****.
audit,3_science_LS1,about roughage comprehension questions food audit hots do it yoursalf,About roughage comprehension questions food ***** hots do it yoursalf,They have a great advantage in ease of audit time and payment .,They have a great advantage in ease of ***** time and payment ., Dad went to an audit at work., dad went to an ***** at work.
push,3_science_LS1,force and listthe types identify push and pull in the,Force and listthe types identify **** and pull in the,"Mantle , it's apparent , resented Casey Stengel's attempts to push and prod him into the perfection the veteran manager saw as a thrilling possibility .","Mantle , it's apparent , resented casey stengel's attempts to **** and prod him into the perfection the veteran manager saw as a thrilling possibility .",Push the door to open.,**** the door to open.
their,3_science_LS1,to view the performance of their children,To view the performance of ***** children,"Dewey Lawrence , a Tyler lawyer representing the Texas Bankers Association , sounded the opposition keynote when he said it would force banks to violate their contractual obligations with depositors and undermine the confidence of bank customers .","Dewey lawrence , a tyler lawyer representing the texas bankers association , sounded the opposition keynote when he said it would force banks to violate ***** contractual obligations with depositors and undermine the confidence of bank customers .",Their house is big.,***** house is big.
formative,3_science_LS1,generator for teachers to create formative or summative assessments worksheets,Generator for teachers to create ********* or summative assessments worksheets,"Very early in his administration he informed the Kremlin through diplomatic channels , a high official source disclosed , that the new administration would react even tougher than the Eisenhower administration would during the formative period of the administration .","Very early in his administration he informed the kremlin through diplomatic channels , a high official source disclosed , that the new administration would react even tougher than the eisenhower administration would during the ********* period of the administration .", Quizzes are formative assessments., quizzes are ********* assessments.
nectar,3_science_LS1,scen a butterfly feeding on nectar,Scen a butterfly feeding on ******,There is a mediocre restaurant at Sounion and I fed a thin little Grecian cat and gave it two saucers of water -- there was no milk -- which it lapped up as though it were nectar .,There is a mediocre restaurant at sounion and i fed a thin little grecian cat and gave it two saucers of water -- there was no milk -- which it lapped up as though it were ****** .,Bees collect nectar from flowers.,Bees collect ****** from flowers.
hew,3_science_LS1,ward wo diferent art fren hew 0 an custint of,Ward wo diferent art fren *** 0 an custint of,No example sentence found.,No example sentence found., We hew wood for the fireplace., we *** wood for the fireplace.
write,3_science_LS1,write one function of the,***** one function of the,I'll write what you tell me to '' .,I'll ***** what you tell me to '' .,I can write my name.,I can ***** my name.
anyone,3_science_LS1,should anyone feel guilty or ashamed,Should ****** feel guilty or ashamed,Mr. Hawksley said yesterday he would be willing to go before the city council `` or anyone else locally '' to outline his proposal at the earliest possible time .,Mr. hawksley said yesterday he would be willing to go before the city council `` or ****** else locally '' to outline his proposal at the earliest possible time .,Can anyone help me?,Can ****** help me?
scenery,3_science_LS1,components draw and colour a scenery explain fill in the,Components draw and colour a ******* explain fill in the,"It was done with great taste , was big and spacious , sumptuous as the dreams of any peasant in its courtly costumes , but sumptuous in a muted , pastel-like style , with rich , quiet harmonies of color between the costumes themselves and between the costumes and the scenery .","It was done with great taste , was big and spacious , sumptuous as the dreams of any peasant in its courtly costumes , but sumptuous in a muted , pastel-like style , with rich , quiet harmonies of color between the costumes themselves and between the costumes and the ******* .", The mountain scenery is beautiful., the mountain ******* is beautiful.
involved,3_science_LS1,offer to all the stakeholders involved in the journey of,Offer to all the stakeholders ******** in the journey of,"Salinger said the work President Kennedy , advisers , and members of his staff were doing on the address involved composition and wording , rather than last minute decisions on administration plans to meet the latest Berlin crisis precipitated by Russia's demands and proposals for the city .","Salinger said the work president kennedy , advisers , and members of his staff were doing on the address ******** composition and wording , rather than last minute decisions on administration plans to meet the latest berlin crisis precipitated by russia's demands and proposals for the city .",She was involved in the project.,She was ******** in the project.
can,3_science_LS1,schools a platform which they can easily adapt to,Schools a platform which they *** easily adapt to,Pelham said Sunday night there was research being done on whether the `` quickie '' vote on the increase can be repealed outright or whether notice would have to first be given that reconsideration of the action would be sought .,Pelham said sunday night there was research being done on whether the `` quickie '' vote on the increase *** be repealed outright or whether notice would have to first be given that reconsideration of the action would be sought .,I can ride a bike.,I *** ride a bike.
ward,3_science_LS1,katomtet did denagee are cemnoely ward wo diferent art fren,Katomtet did denagee are cemnoely **** wo diferent art fren,"Mayer Goldberg , attorney for election judges in the 58th precinct of the 23d ward , argued this procedure constituted intimidation .","Mayer goldberg , attorney for election judges in the 58th precinct of the 23d **** , argued this procedure constituted intimidation .", He was in the hospital ward., he was in the hospital ****.
distinguish,3_science_LS1,it also helps us to distinguish between different smells,It also helps us to *********** between different smells,Do you rigidly distinguish between job- and non-job-connected health problems and avoid treating the latter ? ?,Do you rigidly *********** between job- and non-job-connected health problems and avoid treating the latter ? ?, Can you distinguish between these colors?, can you *********** between these colors?
paragraph,3_science_LS1,it talk about complete the paragraph c114 and that air,It talk about complete the ********* c114 and that air,"However , by comparing the TV snatches , two different radio station re-runs , and the censored Los Angeles Times version , I found that the radio stations had edited out questions ( ABC removed the one regarding Laos ) or even a paragraph out of the middle of the President's answer .","However , by comparing the tv snatches , two different radio station re-runs , and the censored los angeles times version , i found that the radio stations had edited out questions ( abc removed the one regarding laos ) or even a ********* out of the middle of the president's answer .",Write a paragraph about dogs.,Write a ********* about dogs.
acetone,3_science_LS1,i cgi sis le esas acetone ieiearenh s cl a,I cgi sis le esas ******* ieiearenh s cl a,"After their work other investigators applied salt-fractionation techniques to the problem , as well as fractionation with organic solvents , such as acetone .","After their work other investigators applied salt-fractionation techniques to the problem , as well as fractionation with organic solvents , such as ******* .", Mom uses acetone to remove nail polish., mom uses ******* to remove nail polish.
set,3_science_LS1,provides a large and indispensable set of features to support,Provides a large and indispensable *** of features to support,"While emphasizing that technical details were not fully worked out , Pelham said his resolution would seek to set aside the privilege resolution which the House voted through 87-31 .","While emphasizing that technical details were not fully worked out , pelham said his resolution would seek to *** aside the privilege resolution which the house voted through 87-31 .",Set the table for dinner.,*** the table for dinner.
note,3_science_LS1,ar hat has empacted the note to the teacher tal,Ar hat has empacted the **** to the teacher tal,A note making the request was handed to U.S. Ambassador Winthrop G. Brown .,A **** making the request was handed to u.s. ambassador winthrop g. brown .,Please take note of the date.,Please take **** of the date.
background,3_science_LS1,a ay 3 information laeracy background knowledge i i uarranrae,A ay 3 information laeracy ********** knowledge i i uarranrae,"The 53-year-old Shea , a prominent corporation lawyer with a sports background , is generally recognized as the man most responsible for the imminent return of a National League club to New York .","The 53-year-old shea , a prominent corporation lawyer with a sports ********** , is generally recognized as the man most responsible for the imminent return of a national league club to new york .", The artist painted a blue background., the artist painted a blue **********.
spinal,3_science_LS1,ni system consists of the spinal cord and a network,Ni system consists of the ****** cord and a network,No example sentence found.,No example sentence found.,The spinal cord protects nerves.,The ****** cord protects nerves.
perform,3_science_LS1,the two ectons will you perform first if you nave,The two ectons will you ******* first if you nave,"While the city council suggested that the Legislative Council might perform the review , Mr. Notte said that instead he will take up the matter with Atty. Gen. J. Joseph Nugent to get `` the benefit of his views '' .","While the city council suggested that the legislative council might ******* the review , mr. notte said that instead he will take up the matter with atty. gen. j. joseph nugent to get `` the benefit of his views '' .",I perform on stage.,I ******* on stage.
lifelong,3_science_LS1,that build the foundation for lifelong learning,That build the foundation for ******** learning,"but the old fellow , a lifelong teetotaler , refused it , and no more was thought of the matter .","But the old fellow , a ******** teetotaler , refused it , and no more was thought of the matter .", She has a lifelong love for learning., she has a ******** love for learning.
move,3_science_LS1,of the lesson living things move o eran y eontiome,Of the lesson living things **** o eran y eontiome,"The governor's move into the so-called `` blue law '' controversy came in the form of a letter to Miss Mary R. Grant , deputy city clerk of Central Falls .","The governor's **** into the so-called `` blue law '' controversy came in the form of a letter to miss mary r. grant , deputy city clerk of central falls .",Let's move to the next game.,Let's **** to the next game.
relationship,3_science_LS1,given pictures cg1cg5cg7 c121 describes relationship between force and motion,Given pictures cg1cg5cg7 c121 describes ************ between force and motion,It was when he attempted to end the relationship that the murder took place .,It was when he attempted to end the ************ that the murder took place .,I have a good relationship with my friends.,I have a good ************ with my friends.
side,3_science_LS1,cored oe hop crawi nm side me work in pais,Cored oe hop crawi nm **** me work in pais,On the negative side of the balance sheet must be set some disappointment that the United States leadership has not been as much in evidence as hoped for .,On the negative **** of the balance sheet must be set some disappointment that the united states leadership has not been as much in evidence as hoped for .,Stand by my side.,Stand by my ****.
active,3_science_LS1,information literac 91 138 139 active experimentation 138 139 experiential,Information literac 91 138 139 ****** experimentation 138 139 experiential,Both have been active in the association .,Both have been ****** in the association .,She is active at the park.,She is ****** at the park.
close,3_science_LS1,leaves of a touchmenot plant close when touched,Leaves of a touchmenot plant ***** when touched,"Dr. Clark will succeed Dr. J. R. McLemore , who will retire at the close of the present school term .","Dr. clark will succeed dr. j. r. mclemore , who will retire at the ***** of the present school term .","Close the door gently, please.","***** the door gently, please."
classroom,3_science_LS1,support educational activities such as classroom learning and distance education,Support educational activities such as ********* learning and distance education,Business firms provide 20 weeks of practical employment to supplement classroom instruction in these fields .,Business firms provide 20 weeks of practical employment to supplement ********* instruction in these fields ., Our classroom is on the second floor., our ********* is on the second floor.
working,3_science_LS1,you seen ants moving and working together as a team,You seen ants moving and ******* together as a team,-- President Kennedy today pushed aside other White House business to devote all his time and attention to working on the Berlin crisis address he will deliver tomorrow night to the American people over nationwide television and radio .,-- president kennedy today pushed aside other white house business to devote all his time and attention to ******* on the berlin crisis address he will deliver tomorrow night to the american people over nationwide television and radio .,Mom is working at home.,Mom is ******* at home.
psychomotor,3_science_LS1,small browncoloured bird wath i psychomotor domains to come tac,Small browncoloured bird wath i *********** domains to come tac,No example sentence found.,No example sentence found., My dance class improves psychomotor skills., my dance class improves *********** skills.
bouquet,3_science_LS1,and teaching processes with a bouquet of digital resources for,And teaching processes with a ******* of digital resources for,"But in his dressing room was a large bouquet and a card that read , `` We're with you all the way '' .","But in his dressing room was a large ******* and a card that read , `` we're with you all the way '' .", Mom received a beautiful bouquet., mom received a beautiful *******.
hoon,3_science_LS1,riddle correct the slalements co hoon cr deere sterile tahaaste,Riddle correct the slalements co **** cr deere sterile tahaaste,No example sentence found.,No example sentence found.," ""Hoon"" might be complex; can refer to fast driving."," ""****"" might be complex; can refer to fast driving."
