word,word_type,chunked_sentence,masked_chunked_sentence,example_sentence,masked_example_sentence,openai_sentence,masked_openai_sentence
concept,3_science_LS1,page 72 concept recall 1 keeps the,Page 72 ******* recall 1 keeps the,It is ironic that Washington is having to struggle so for a concept that for six years it bypassed as unreasonable .,It is ironic that washington is having to struggle so for a ******* that for six years it bypassed as unreasonable .,Learning letters is a basic concept.,Learning letters is a basic *******.
critical,3_science_LS1,higherorder skills such as analysing critical thinking and conceptual clarity,Higherorder skills such as analysing ******** thinking and conceptual clarity,Its spokesmen insist that there has not been time enough to institute reforms in military and economic aid policies in the critical areas .,Its spokesmen insist that there has not been time enough to institute reforms in military and economic aid policies in the ******** areas .,Be critical when crossing roads.,Be ******** when crossing roads.
up,3_science_LS1,air is lighter and rises up 5 seth the following,Air is lighter and rises ** 5 seth the following,State Party Chairman James W. Dorsey added that enthusiasm was picking up for a state rally to be held Sept. 8 in Savannah at which newly elected Texas Sen. John Tower will be the featured speaker .,State party chairman james w. dorsey added that enthusiasm was picking ** for a state rally to be held sept. 8 in savannah at which newly elected texas sen. john tower will be the featured speaker .,The balloon goes up.,The balloon goes **.
balance,3_science_LS1,findings through different creative modes balance in alure the activities,Findings through different creative modes ******* in alure the activities,On the negative side of the balance sheet must be set some disappointment that the United States leadership has not been as much in evidence as hoped for .,On the negative side of the ******* sheet must be set some disappointment that the united states leadership has not been as much in evidence as hoped for .,I balance on one foot.,I ******* on one foot.
secure,3_science_LS1,of the location with the secure mobile app available for,Of the location with the ****** mobile app available for,The AID has undertaken the redecoration of the White House library as a project in connection with the work being done by First Lady Jacqueline Kennedy's Fine Arts Advisory Committee to secure antiques for the presidential home .,The aid has undertaken the redecoration of the white house library as a project in connection with the work being done by first lady jacqueline kennedy's fine arts advisory committee to ****** antiques for the presidential home ., Wear a helmet to be secure., wear a helmet to be ******.
productivity,3_science_LS1,such as leadership initiative and productivity skills,Such as leadership initiative and ************ skills,Productivity of U.S. miners is twice that of the British .,************ of u.s. miners is twice that of the british ., Being organized improves productivity., being organized improves ************.
carter,3_science_LS1,id hee in he locality carter 3g0degree holistic peers renee,Id hee in he locality ****** 3g0degree holistic peers renee,"Cecil Mason of Hartford , Conn. , was best man for his brother , and groomsmen were Rhodes S. Baker 3 , of Houston , Dr. James Carter of Houston and Conrad McEachern of New Orleans , La. .","Cecil mason of hartford , conn. , was best man for his brother , and groomsmen were rhodes s. baker 3 , of houston , dr. james ****** of houston and conrad mceachern of new orleans , la. .", Carter found a bug., ****** found a bug.
record,3_science_LS1,do it yourself weather record 11 water c21 identifies,Do it yourself weather ****** 11 water c21 identifies,Only 11 senators were on the floor and there was no record vote .,Only 11 senators were on the floor and there was no ****** vote .,I record my voice on my phone.,I ****** my voice on my phone.
new,3_science_LS1,education introduces you to a new world of blended learning,Education introduces you to a *** world of blended learning,"Regarding Atlanta's new multi-million-dollar airport , the jury recommended `` that when the new management takes charge Jan. 1 the airport be operated in a manner that will eliminate political influences '' .","Regarding atlanta's *** multi-million-dollar airport , the jury recommended `` that when the *** management takes charge jan. 1 the airport be operated in a manner that will eliminate political influences '' .",I got a new bike.,I got a *** bike.
rare,3_science_LS1,cur it eae genes vee rare ese omaauna eer p,Cur it eae genes vee **** ese omaauna eer p,"For that matter , Stan Musial is rare , possessing the disposition that enabled him to put out the same for seven managers , reserving his opinions , but not his effort .","For that matter , stan musial is **** , possessing the disposition that enabled him to put out the same for seven managers , reserving his opinions , but not his effort .", It's rare to see a blue moon., it's **** to see a blue moon.
keep,3_science_LS1,to keep the brain active we,To **** the brain active we,"`` We must keep the bloodstream of New Jersey clean '' , the former Superior Court judge said .","`` we must **** the bloodstream of new jersey clean '' , the former superior court judge said .",Keep your room clean.,**** your room clean.
till,3_science_LS1,wait till the light turns green,Wait **** the light turns green,Till seven times ? ?,**** seven times ? ?,Work till you finish.,Work **** you finish.
warm,3_science_LS1,recall 1 keeps the body warm and gives energy,Recall 1 keeps the body **** and gives energy,"Heating is by individual gas-fired , forced warm air systems .","Heating is by individual gas-fired , forced **** air systems .",The sun is warm.,The sun is ****.
process,3_science_LS1,grades and manage the teachinglearning process efficiently and effectively,Grades and manage the teachinglearning ******* efficiently and effectively,"`` Actually , the abuse of the process may have constituted a contempt of the Criminal court of Cook county , altho vindication of the authority of that court is not the function of this court '' , said Karns , who is a City judge in East St. Louis sitting in Cook County court .","`` actually , the abuse of the ******* may have constituted a contempt of the criminal court of cook county , altho vindication of the authority of that court is not the function of this court '' , said karns , who is a city judge in east st. louis sitting in cook county court .",Baking is a process.,Baking is a *******.
cord,3_science_LS1,system consists of the spinal cord and a network 4,System consists of the spinal **** and a network 4,"Some liver cord cells contained vacuolated cytoplasm , while others had small amounts of brown hemosiderin pigment .","Some liver **** cells contained vacuolated cytoplasm , while others had small amounts of brown hemosiderin pigment .",Plug in the cord for power.,Plug in the **** for power.
story,3_science_LS1,ss properties and weave a story identify fill in the,Ss properties and weave a ***** identify fill in the,I visited the bank in March and wrote a story about the situation .,I visited the bank in march and wrote a ***** about the situation .,Read me a bedtime story.,Read me a bedtime *****.
type,3_science_LS1,the stem mech identify the type of plant ooh o21,The stem mech identify the **** of plant ooh o21,Mr. Reama told the Rotary Club of Providence at its luncheon at the Sheraton-Biltmore Hotel that about half of the people in the country want the `` welfare '' type of government and the other half want a free enterprise system .,Mr. reama told the rotary club of providence at its luncheon at the sheraton-biltmore hotel that about half of the people in the country want the `` welfare '' **** of government and the other half want a free enterprise system .,I can type my name.,I can **** my name.
removing,3_science_LS1,the organs that help in removing the waste from the,The organs that help in ******** the waste from the,"( Even granted that the Congo should be unified , you don't protect Western security by first removing the pro-Western weight from the power equilibrium .","( even granted that the congo should be unified , you don't protect western security by first ******** the pro-western weight from the power equilibrium .",She's removing the weeds from the garden.,She's ******** the weeds from the garden.
machine,3_science_LS1,these parts together make a machine called the page nummber,These parts together make a ******* called the page nummber,For a number of years the board used a machine to keep a permanent record but abandoned the practice about two years ago .,For a number of years the board used a ******* to keep a permanent record but abandoned the practice about two years ago .,This is a sewing machine.,This is a sewing *******.
educational,3_science_LS1,set of features to support educational activities such as classroom,Set of features to support *********** activities such as classroom,"-- A Houston teacher , now serving in the Legislature , proposed Thursday a law reducing the time spent learning `` educational methods '' .","-- a houston teacher , now serving in the legislature , proposed thursday a law reducing the time spent learning `` *********** methods '' .", This game is educational., this game is ***********.
doing,3_science_LS1,environment 140 environment learning by doing crosscurricular project1 saga animal,Environment 140 environment learning by ***** crosscurricular project1 saga animal,"Salinger said the work President Kennedy , advisers , and members of his staff were doing on the address involved composition and wording , rather than last minute decisions on administration plans to meet the latest Berlin crisis precipitated by Russia's demands and proposals for the city .","Salinger said the work president kennedy , advisers , and members of his staff were ***** on the address involved composition and wording , rather than last minute decisions on administration plans to meet the latest berlin crisis precipitated by russia's demands and proposals for the city .",What are you doing?,What are you *****?
experience,3_science_LS1,using the url below and experience a new world of,Using the url below and ********** a new world of,"`` My experience as public safety commissioner '' , Roos said , `` has shown me that the office of sheriff is best filled by a man with law enforcement experience , and preferably one who is a lawyer .","`` my ********** as public safety commissioner '' , roos said , `` has shown me that the office of sheriff is best filled by a man with law enforcement ********** , and preferably one who is a lawyer .",I had a fun experience at the zoo.,I had a fun ********** at the zoo.
enact,3_science_LS1,acvy skillbased activities feed end enact a tale every country,Acvy skillbased activities feed end ***** a tale every country,"Rep. Charles E. Hughes of Sherman , sponsor of the bill , said a failure to enact it would amount `` to making a gift out of the taxpayers' pockets to banks , insurance and pipeline companies '' .","Rep. charles e. hughes of sherman , sponsor of the bill , said a failure to ***** it would amount `` to making a gift out of the taxpayers' pockets to banks , insurance and pipeline companies '' .", We enact a play in class., we ***** a play in class.
identity,3_science_LS1,the pace and suck i identity he natonal enema of,The pace and suck i ******** he natonal enema of,"The Washington state supreme court ruled that the state's occupation tax applied to sales , made at cost to an oil company , by a wholly-owned subsidiary set up to purchase certain supplies without divulging the identity of the parent .","The washington state supreme court ruled that the state's occupation tax applied to sales , made at cost to an oil company , by a wholly-owned subsidiary set up to purchase certain supplies without divulging the ******** of the parent .", My badge shows my identity., my badge shows my ********.
encourage,3_science_LS1,they encourage leamers to perform simple,They ********* leamers to perform simple,Foreign aid programs were revamped to give greater emphasis to economic aid and to encourage political reform in recipient nations .,Foreign aid programs were revamped to give greater emphasis to economic aid and to ********* political reform in recipient nations .,Always encourage your friends.,Always ********* your friends.
heart,3_science_LS1,the heart stomach kidneys lungs and,The ***** stomach kidneys lungs and,"Even Norway , despite daily but limited manifestations against atomic arms in the heart of this northernmost capital of the alliance , is today closer to the NATO line .","Even norway , despite daily but limited manifestations against atomic arms in the ***** of this northernmost capital of the alliance , is today closer to the nato line .",My heart beats fast when I run.,My ***** beats fast when i run.
against,3_science_LS1,b fight against diseases,B fight ******* diseases,Vandiver opened his race for governor in 1958 with a battle in the Legislature against the issuance of $50 million worth of additional rural roads bonds proposed by then Gov. Marvin Griffin .,Vandiver opened his race for governor in 1958 with a battle in the legislature ******* the issuance of $50 million worth of additional rural roads bonds proposed by then gov. marvin griffin .,Racing against time is hard.,Racing ******* time is hard.
its,3_science_LS1,a tale every country nas its national animal declaring any,A tale every country nas *** national animal declaring any,"The jury also commented on the Fulton ordinary's court which has been under fire for its practices in the appointment of appraisers , guardians and administrators and the awarding of fees and compensation .","The jury also commented on the fulton ordinary's court which has been under fire for *** practices in the appointment of appraisers , guardians and administrators and the awarding of fees and compensation .",The dog wagged its tail.,The dog wagged *** tail.
weave,3_science_LS1,liquids and ss properties and weave a story identify fill,Liquids and ss properties and ***** a story identify fill,"In a lacey open weave shoes have a luster finish , braided collar and bow highlight on the squared throat .","In a lacey open ***** shoes have a luster finish , braided collar and bow highlight on the squared throat .", Grandma can weave a basket., grandma can ***** a basket.
test,3_science_LS1,each chapter for learners selfpractice test generator for teachers to,Each chapter for learners selfpractice **** generator for teachers to,"The bond issue will go to the state courts for a friendly test suit to test the validity of the act , and then the sales will begin and contracts let for repair work on some of Georgia's most heavily traveled highways .","The bond issue will go to the state courts for a friendly **** suit to **** the validity of the act , and then the sales will begin and contracts let for repair work on some of georgia's most heavily traveled highways .",We have a spelling test tomorrow.,We have a spelling **** tomorrow.
important,3_science_LS1,the heart plays an important role in the body,The heart plays an ********* role in the body,"In an important assertion of national leadership in this field , he has issued an executive order establishing the President's committee on Juvenile Delinquency and Crime , to be supported and assisted by a Citizens Advisory Council of recognized authorities on juvenile problems .","In an ********* assertion of national leadership in this field , he has issued an executive order establishing the president's committee on juvenile delinquency and crime , to be supported and assisted by a citizens advisory council of recognized authorities on juvenile problems .",It's important to be kind.,It's ********* to be kind.
just,3_science_LS1,called the page nummber 8 just as the computer and,Called the page nummber 8 **** as the computer and,`` Being at the polls was just like being at church .,`` being at the polls was **** like being at church .,I just finished my snack.,I **** finished my snack.
strength,3_science_LS1,called asanas which improve the strength and flexibility of the,Called asanas which improve the ******** and flexibility of the,"One effect of the proposal , which puts a premium on population instead of economic strength , as in the past , would be to take jobs from European nations and give more to such countries as India .","One effect of the proposal , which puts a premium on population instead of economic ******** , as in the past , would be to take jobs from european nations and give more to such countries as india .",He has great strength.,He has great ********.
remains,3_science_LS1,the frame remains inside and provides support,The frame ******* inside and provides support,"Now he's gone , the Republican Party is not going to be able to sell the tattered remains to the people of the state '' .","Now he's gone , the republican party is not going to be able to sell the tattered ******* to the people of the state '' .",Only the cake remains were left.,Only the cake ******* were left.
safety,3_science_LS1,false c31 desoribes the basic safety needs and protection of,False c31 desoribes the basic ****** needs and protection of,"The candidacy of Mayor James J. Sheeran of West Orange , for the Republican nomination for sheriff of Essex County , was supported today by Edward W. Roos , West Orange public safety commissioner .","The candidacy of mayor james j. sheeran of west orange , for the republican nomination for sheriff of essex county , was supported today by edward w. roos , west orange public ****** commissioner .", Always think about safety., always think about ******.
external,3_science_LS1,they are the external organs,They are the ******** organs,"W. Averell Harriman of the United States , Malcolm MacDonald of Britain , Maurice Couve De Murville , France's Foreign Minister , and Howard C. Green , Canada's Minister of External Affairs , concluded , meanwhile , a round of consultations here on future tactics in the conference .","W. averell harriman of the united states , malcolm macdonald of britain , maurice couve de murville , france's foreign minister , and howard c. green , canada's minister of ******** affairs , concluded , meanwhile , a round of consultations here on future tactics in the conference .",The external part of the house is painted.,The ******** part of the house is painted.
revise,3_science_LS1,flow ca 0 chart to revise the as be names,Flow ca 0 chart to ****** the as be names,Tom was not willing to revise the play according to the plan the man suggested .,Tom was not willing to ****** the play according to the plan the man suggested ., Let's revise our essays., let's ****** our essays.
ask,3_science_LS1,share a ial puzzle and ask your friends to solve,Share a ial puzzle and *** your friends to solve,Ask jail deputies,*** jail deputies,Always ask before taking.,Always *** before taking.
mixed,3_science_LS1,bo eaten make mixed frult salad corract option,Bo eaten make ***** frult salad corract option,These are then mixed by their sound engineers with the active co-operation of the musical staff and combined into the final two channels which are impressed on the record .,These are then ***** by their sound engineers with the active co-operation of the musical staff and combined into the final two channels which are impressed on the record .,We mixed the paint colors.,We ***** the paint colors.
help,3_science_LS1,birds have wings that help them fly,Birds have wings that **** them fly,Daniel termed `` extremely conservative '' his estimate that it would produce 17 million dollars to help erase an anticipated deficit of 63 million dollars at the end of the current fiscal year next Aug. 31 .,Daniel termed `` extremely conservative '' his estimate that it would produce 17 million dollars to **** erase an anticipated deficit of 63 million dollars at the end of the current fiscal year next aug. 31 .,Can you help me with homework?,Can you **** me with homework?
badly,3_science_LS1,pf ba nanas hewly nanna badly plead understand and anawerqueationa,Pf ba nanas hewly nanna ***** plead understand and anawerqueationa,"Split badly during the recent presidential election into almost equally divided camps of party loyalists and independents , the Democratic party in Mississippi is currently a wreck .","Split ***** during the recent presidential election into almost equally divided camps of party loyalists and independents , the democratic party in mississippi is currently a wreck .", He felt badly after falling., he felt ***** after falling.
where,3_science_LS1,will be able tor state where birds live,Will be able tor state ***** birds live,The Georgia Legislature will wind up its 1961 session Monday and head for home -- where some of the highway bond money it approved will follow shortly .,The georgia legislature will wind up its 1961 session monday and head for home -- ***** some of the highway bond money it approved will follow shortly .,Where is my book?,***** is my book?
pom,3_science_LS1,at tl tak b ee pom a at a the,At tl tak b ee *** a at a the,No example sentence found.,No example sentence found.,"(Note: ""Pom"" might not be a familiar word for 2nd graders.)","(note: ""***"" might not be a familiar word for 2nd graders.)"
breakfast,3_science_LS1,food of animals analyse ones breakfast explainhow choose the words,Food of animals analyse ones ********* explainhow choose the words,"They divide up the household chores : Cerv does most of the cooking ( breakfast and sandwich snacks , with dinner out ) , Mantle supplies the transportation ( a white 1961 Oldsmobile convertible ) , and Maris drives the 25-minute course from the apartment house to Yankee Stadium .","They divide up the household chores : cerv does most of the cooking ( ********* and sandwich snacks , with dinner out ) , mantle supplies the transportation ( a white 1961 oldsmobile convertible ) , and maris drives the 25-minute course from the apartment house to yankee stadium .", I eat cereal for breakfast., i eat cereal for *********.
class,3_science_LS1,can do wonders in the class,Can do wonders in the *****,"Stengel inherited DiMaggio , Rizzuto , but he brought up Mantle from Class C to the majors , from Joplin to New York .","Stengel inherited dimaggio , rizzuto , but he brought up mantle from ***** c to the majors , from joplin to new york .",We have math class today.,We have math ***** today.
project,3_science_LS1,tongue into i crosscurricul ar project the mouth and swallow,Tongue into i crosscurricul ar ******* the mouth and swallow,"The bill would increase from $5,000,000 to $15,000,000 the maximum loan the state could make to a local water project .","The bill would increase from $5,000,000 to $15,000,000 the maximum loan the state could make to a local water ******* .",Our class project is about space.,Our class ******* is about space.
experimentation,3_science_LS1,literac 91 138 139 active experimentation 138 139 experiential learning,Literac 91 138 139 active *************** 138 139 experiential learning,"Since the apparatus is new , it requires experimentation and changes in technique .","Since the apparatus is new , it requires *************** and changes in technique .", Science is fun with experimentation., science is fun with ***************.
colour,3_science_LS1,hots c sey study a colour the picture virtual tour,Hots c sey study a ****** the picture virtual tour,No example sentence found.,No example sentence found.,What colour is your shirt?,What ****** is your shirt?
web,3_science_LS1,food chain and and food web c45 dentifies needs of,Food chain and and food *** c45 dentifies needs of,"For by now the original cause of the quarrel , Philip's seizure of Gascony , was only one strand in the spider web of French interests that overlay all western Europe and that had been so well and closely spun that the lightest movement could set it trembling from one end to the other .","For by now the original cause of the quarrel , philip's seizure of gascony , was only one strand in the spider *** of french interests that overlay all western europe and that had been so well and closely spun that the lightest movement could set it trembling from one end to the other .",A spider spins a web.,A spider spins a ***.
ods,3_science_LS1,we brad smits ae yy ods 4 oe nae page,We brad smits ae yy *** 4 oe nae page,No example sentence found.,No example sentence found.," ""Odds"" could be a typo; a sentence might be ""The odds are good."""," ""odds"" could be a typo; a sentence might be ""the odds are good."""
pot,3_science_LS1,neue anef senue wee es pot to nattooat cupp ecotd,Neue anef senue wee es *** to nattooat cupp ecotd,The melting pot .,The melting *** .,I cook soup in a pot.,I cook soup in a ***.
right,3_science_LS1,but a teacher with the right technical tools can do,But a teacher with the ***** technical tools can do,"Natural gas public utility companies would be given the right of eminent domain , under a bill by Sen. Frank Owen 3 , of El Paso , to acquire sites for underground storage reservoirs for gas .","Natural gas public utility companies would be given the ***** of eminent domain , under a bill by sen. frank owen 3 , of el paso , to acquire sites for underground storage reservoirs for gas .",You got the answer right.,You got the answer *****.
together,3_science_LS1,seen ants moving and working together as a team,Seen ants moving and working ******** as a team,The petition said that the couple has not lived together as man and wife for more than a year .,The petition said that the couple has not lived ******** as man and wife for more than a year .,We play together.,We play ********.
