word,word_type,chunked_sentence,masked_chunked_sentence,example_sentence,masked_example_sentence,openai_sentence,masked_openai_sentence
environment,3_science_LS1,our environment 140 environment learning by,Our *********** 140 *********** learning by,He accepted the environment of his destiny -- took root and grew to fulfill the stature of his early promise .,He accepted the *********** of his destiny -- took root and grew to fulfill the stature of his early promise .,Trees are good for the environment.,Trees are good for the ***********.
source,3_science_LS1,a picture and infer the source of dewdrops true or,A picture and infer the ****** of dewdrops true or,A Highway Department source said there also is a plan there to issue some $3 million to $4 million worth of Rural Roads Authority bonds for rural road construction work .,A highway department ****** said there also is a plan there to issue some $3 million to $4 million worth of rural roads authority bonds for rural road construction work .,The sun is the source of light.,The sun is the ****** of light.
erect,3_science_LS1,we can stand erect because a our respiratory,We can stand ***** because a our respiratory,"If the Republicans and Southern Democrats join to defeat medical care for the old under the Social Security program , they will thereby erect still another barrier to GOP hopes in the cities .","If the republicans and southern democrats join to defeat medical care for the old under the social security program , they will thereby ***** still another barrier to gop hopes in the cities .", The flagpole stands erect., the flagpole stands *****.
varied,3_science_LS1,knowledge of india and its varied culture oe alter the,Knowledge of india and its ****** culture oe alter the,Accounting procedures can be varied to provide a rationale for almost any price .,Accounting procedures can be ****** to provide a rationale for almost any price ., The menu has varied options., the menu has ****** options.
performance,3_science_LS1,with analytics for each learners performance to the minutest detail,With analytics for each learners *********** to the minutest detail,Their view is that last-minute changes the Mayor is proposing to make in the Democratic ticket only emphasize the weakness of his performance as Mayor .,Their view is that last-minute changes the mayor is proposing to make in the democratic ticket only emphasize the weakness of his *********** as mayor ., She gave a great performance., she gave a great ***********.
information,3_science_LS1,this information wil 0 cur it,This *********** wil 0 cur it,Opponents generally argued that the ballot couldn't give enough information about tax proposals for the voters to make an intelligent choice .,Opponents generally argued that the ballot couldn't give enough *********** about tax proposals for the voters to make an intelligent choice .,I found information in a book.,I found *********** in a book.
action,3_science_LS1,infer biting as the first action of eating food spa,Infer biting as the first ****** of eating food spa,Schley County Rep. B. D. Pelham will offer a resolution Monday in the House to rescind the body's action of Friday in voting itself a $10 per day increase in expense allowances .,Schley county rep. b. d. pelham will offer a resolution monday in the house to rescind the body's ****** of friday in voting itself a $10 per day increase in expense allowances .," Run fast, it's action time."," run fast, it's ****** time."
or,3_science_LS1,be it learners parents teachers or principals,Be it learners parents teachers ** principals,The jury said it did find that many of Georgia's registration and election laws `` are outmoded or inadequate and often ambiguous '' .,The jury said it did find that many of ge**gia's registration and election laws `` are outmoded ** inadequate and often ambiguous '' .,Do you want tea or coffee?,Do you want tea ** coffee?
indispensable,3_science_LS1,that provides a large and indispensable set of features to,That provides a large and ************* set of features to,"The President said his proposals combine the `` indispensable elements in a sound health program -- people , knowledge , services , facilities , and the means to pay for them '' .","The president said his proposals combine the `` ************* elements in a sound health program -- people , knowledge , services , facilities , and the means to pay for them '' .", Water is indispensable for life., water is ************* for life.
feathered,3_science_LS1,birdsour feathered friends 72 7,Birdsour ********* friends 72 7,"It ran , this apocalyptic beast , on two thin legs , and its wings -- were they feathered arms ? ?","It ran , this apocalyptic beast , on two thin legs , and its wings -- were they ********* arms ? ?", Birds have feathered wings., birds have ********* wings.
hub,3_science_LS1,mee is an online education hub that provides a large,Mee is an online education *** that provides a large,"A wheel squeaked on a hub , was still , and squeaked again .","A wheel squeaked on a *** , was still , and squeaked again .", The city is a hub of activity., the city is a *** of activity.
oneself,3_science_LS1,and non compare pictures of oneself animal fill ln the,And non compare pictures of ******* animal fill ln the,"Within the membership of this group , as has been found true of men in other professional or trade associations , the most ready portrayal of oneself to `` the public '' is that of a neutral agent simply serving the interests of a seller or buyer and mediating between them .","Within the membership of this group , as has been found true of men in other professional or trade associations , the most ready portrayal of ******* to `` the public '' is that of a neutral agent simply serving the interests of a seller or buyer and mediating between them .", You should be yourself., you should be yourself.
horse,3_science_LS1,a horse runs,A ***** runs,Dallas may get to hear a debate on horse race parimutuels soon between Reps. V. E. ( Red ) Berry and Joe Ratcliff .,Dallas may get to hear a debate on ***** race parimutuels soon between reps. v. e. ( red ) berry and joe ratcliff .,The horse ran fast.,The ***** ran fast.
border,3_science_LS1,te ce do it yourself border design fos fal observes,Te ce do it yourself ****** design fos fal observes,He has served as a border patrolman and was in the Signal Corps of the U.S. Army .,He has served as a ****** patrolman and was in the signal corps of the u.s. army ., The fence marks the border., the fence marks the ******.
animal,3_science_LS1,by doing crosscurricular project1 saga animal diaries learning by doing,By doing crosscurricular project1 saga ****** diaries learning by doing,Mrs. Knauer said she did not think dog owners should be penalized for the city's services to animal care .,Mrs. knauer said she did not think dog owners should be penalized for the city's services to ****** care .,A dog is an animal.,A dog is an ******.
biotic,3_science_LS1,protection of birds and animals biotic and abiotic draw and,Protection of birds and animals ****** and a****** draw and,No example sentence found.,No example sentence found.,Trees are biotic components.,Trees are ****** components.
design,3_science_LS1,ce do it yourself border design fos fal observes and,Ce do it yourself border ****** fos fal observes and,With the machinery went a complete design for the hull .,With the machinery went a complete ****** for the hull .,I design my dream house.,I ****** my dream house.
function,3_science_LS1,that the body needs to function properly,That the body needs to ******** properly,"`` Actually , the abuse of the process may have constituted a contempt of the Criminal court of Cook county , altho vindication of the authority of that court is not the function of this court '' , said Karns , who is a City judge in East St. Louis sitting in Cook County court .","`` actually , the abuse of the process may have constituted a contempt of the criminal court of cook county , altho vindication of the authority of that court is not the ******** of this court '' , said karns , who is a city judge in east st. louis sitting in cook county court .",My new watch has a timer function.,My new watch has a timer ********.
language,3_science_LS1,concepts 9 explained in lucid language supported with accurate illustrationsphotographs,Concepts 9 explained in lucid ******** supported with accurate illustrationsphotographs,And you think you have language problems .,And you think you have ******** problems .,We're learning a new language at school.,We're learning a new ******** at school.
care,3_science_LS1,eee page nummber 16 taking care of the body and,Eee page nummber 16 taking **** of the body and,-- President Kennedy today proposed a mammoth new medical care program whereby social security taxes on 70 million American workers would be raised to pay the hospital and some other medical bills of 14.2 million Americans over 65 who are covered by social security or railroad retirement programs .,-- president kennedy today proposed a mammoth new medical **** program whereby social security taxes on 70 million american workers would be raised to pay the hospital and some other medical bills of 14.2 million americans over 65 who are covered by social security or railroad retirement programs .,I care about my friends.,I **** about my friends.
more,3_science_LS1,every chapter glossary and much more,Every chapter glossary and much ****,The petition said that the couple has not lived together as man and wife for more than a year .,The petition said that the couple has not lived together as man and wife for **** than a year .,"I want more apples, please.","I want **** apples, please."
curricular,3_science_LS1,exercises concepts warmupactivity a 3 curricular competencies goals 7,Exercises concepts warmupactivity a 3 ********** competencies goals 7,The suggested course of the A.I.D. was based on the usual course offered and on the opinion of many educators as to curricular necessities .,The suggested course of the a.i.d. was based on the usual course offered and on the opinion of many educators as to ********** necessities ., Math is part of the curricular., math is part of the **********.
pant,3_science_LS1,the parts of a plant pant erengonert fv formation of,The parts of a plant **** erengonert fv formation of,No example sentence found.,No example sentence found., The dog pants after running., the dog pants after running.
brain,3_science_LS1,heart stomach kidneys lungs and brain are some internal organs,Heart stomach kidneys lungs and ***** are some internal organs,Give generously when you buy candy today for the Brain Research Foundation .,Give generously when you buy candy today for the ***** research foundation .,Our brain helps us think.,Our ***** helps us think.
urinary,3_science_LS1,the kidneys ureters and urinary bladder form the main,The kidneys ureters and ******* bladder form the main,"The terminal hospital admission on June 27 , 1959 , was necessitated by continued weakness and debility complicated by urinary retention and painful thrombosed hemorrhoids .","The terminal hospital admission on june 27 , 1959 , was necessitated by continued weakness and debility complicated by ******* retention and painful thrombosed hemorrhoids .",The urinary tract is the body's drainage system for removing urine,The ******* tract is the body's drainage system for removing urine
movement,3_science_LS1,plant parts show movement,Plant parts show ********,Mr. Martinelli said yesterday that the Citizens Group of Johnston will meet again July 24 to plan further strategy in the charter movement .,Mr. martinelli said yesterday that the citizens group of johnston will meet again july 24 to plan further strategy in the charter ******** .,I saw movement in the bushes.,I saw ******** in the bushes.
error,3_science_LS1,walter spot the error precio,Walter spot the ***** precio,"Jim Gentile bounced a hard shot off Kunkel's glove and beat it out for a single , and when Lumpe grabbed the ball and threw it over first baseman Throneberry's head Brandt took third and Gentile second on the error .","Jim gentile bounced a hard shot off kunkel's glove and beat it out for a single , and when lumpe grabbed the ball and threw it over first baseman throneberry's head brandt took third and gentile second on the ***** .", Correct the error in your homework., correct the ***** in your homework.
continuous,3_science_LS1,obisb iil ah ey aj continuous and igahne g veo,Obisb iil ah ey aj ********** and igahne g veo,The governor wrote Miss Grant that he has been concerned for some time `` with the continuous problem which confronts our local and state law enforcement officers as a result of the laws regulating Sunday sales '' .,The governor wrote miss grant that he has been concerned for some time `` with the ********** problem which confronts our local and state law enforcement officers as a result of the laws regulating sunday sales '' .,Rain makes a continuous sound.,Rain makes a ********** sound.
taking,3_science_LS1,are you taking in and giving out,Are you ****** in and giving out,-- State representatives decided Thursday against taking a poll on what kind of taxes Texans would prefer to pay .,-- state representatives decided thursday against ****** a poll on what kind of taxes texans would prefer to pay .,I am taking a break.,I am ****** a break.
observe,3_science_LS1,to noniving environment comparison of observe the process of breathing,To noniving environment comparison of ******* the process of breathing,So he keeps the veteran in until he can observe the effects of treatment or surgery .,So he keeps the veteran in until he can ******* the effects of treatment or surgery .,Let's observe the ants working.,Let's ******* the ants working.
so,3_science_LS1,to say that love you so much every single day,To say that love you ** much every single day,It urged that the next Legislature `` provide enabling funds and re-set the effective date so that an orderly implementation of the law may be effected '' .,It urged that the next legislature `` provide enabling funds and re-set the effective date ** that an orderly implementation of the law may be effected '' .,I am so happy.,I am ** happy.
complete,3_science_LS1,read a poem on proteing complete the table foods that,Read a poem on proteing ******** the table foods that,The resolution urges the governor to have a complete study of the Sunday sales laws made with an eye to their revision at the next session of the legislature .,The resolution urges the governor to have a ******** study of the sunday sales laws made with an eye to their revision at the next session of the legislature .,I complete my homework every day.,I ******** my homework every day.
instead,3_science_LS1,dose contact with human deings instead of foresta for years,Dose contact with human deings ******* of foresta for years,"Instead , retailers would sign a certificate of correctness , violation of which would carry a penalty of one to five years in prison , plus a $1,000 fine .","******* , retailers would sign a certificate of correctness , violation of which would carry a penalty of one to five years in prison , plus a $1,000 fine .",Let's play inside instead.,Let's play inside *******.
some,3_science_LS1,some animals can fly,**** animals can fly,"Nevertheless , `` we feel that in the future Fulton County should receive some portion of these available funds '' , the jurors said .","Nevertheless , `` we feel that in the future fulton county should receive **** portion of these available funds '' , the jurors said .",I want some candy.,I want **** candy.
method,3_science_LS1,use the scientific method in investigations and in,Use the scientific ****** in investigations and in,"The annual spring meeting has given an impetus in three main directions : more , deeper , and more timely political consultation within the alliance , the use of the Organization for Economic Cooperation and Development ( when ratified ) as a method of coordinating aid to the underdeveloped countries , and the need for strengthening conventional forces as well as the maintenance of the nuclear deterrent .","The annual spring meeting has given an impetus in three main directions : more , deeper , and more timely political consultation within the alliance , the use of the organization for economic cooperation and development ( when ratified ) as a ****** of coordinating aid to the underdeveloped countries , and the need for strengthening conventional forces as well as the maintenance of the nuclear deterrent .",Follow this method to solve.,Follow this ****** to solve.
cause,3_science_LS1,accidents can happen that can cause injury to our bodies,Accidents can happen that can ***** injury to our bodies,Yet adequate compensation -- and particularly merely adequate compensation is no substitute for those intangibles which cause a man to sacrifice part of his earning potential by taking up college teaching in the first place .,Yet adequate compensation -- and particularly merely adequate compensation is no substitute for those intangibles which ***** a man to sacrifice part of his earning potential by taking up college teaching in the first place .,Eating too much can cause sickness.,Eating too much can ***** sickness.
know,3_science_LS1,oe pa do you know snakes go net have,Oe pa do you **** snakes go net have,"Speaking of the present status of civil defense in the city , Mr. Hawksley said he would be willing to bet that not more than one person in a hundred would know what to do or where to go in the event of an enemy attack .","Speaking of the present status of civil defense in the city , mr. hawksley said he would be willing to bet that not more than one person in a hundred would **** what to do or where to go in the event of an enemy attack .",Do you know how to swim?,Do you **** how to swim?
pact,3_science_LS1,the house sparrows were seen pact id hee in he,The house sparrows were seen **** id hee in he,Board oks pact,Board oks ****, They made a pact to be friends forever., they made a **** to be friends forever.
national,3_science_LS1,are aligned to the latest national curriculum framework for school,Are aligned to the latest ******** curriculum framework for school,He also asked Congress to approve establishment of a national child health institute .,He also asked congress to approve establishment of a ******** child health institute ., Our flag represents our national identity., our flag represents our ******** identity.
most,3_science_LS1,page nummber 9 most of our organs are,Page nummber 9 **** of our organs are,"The bond issue will go to the state courts for a friendly test suit to test the validity of the act , and then the sales will begin and contracts let for repair work on some of Georgia's most heavily traveled highways .","The bond issue will go to the state courts for a friendly test suit to test the validity of the act , and then the sales will begin and contracts let for repair work on some of georgia's **** heavily traveled highways .",She has the most stickers.,She has the **** stickers.
glass,3_science_LS1,talk lst century take a glass of frutt 1 prccaovana,Talk lst century take a ***** of frutt 1 prccaovana,"Members of the committee include Mrs. Milton Bernet , Mrs. J. Clinton Bowman , Mrs. Rollie W. Bradford , Mrs. Samuel Butler Jr. , Mrs. Donald Carr Campbell , Mrs. Douglas Carruthers , Mrs. John C. Davis 3 , , Mrs. Cris Dobbins , Mrs. William E. Glass , Mrs. Alfred Hicks 2 , , Mrs. Donald Magarrell , Mrs. Willett Moore , Mrs. Myron Neusteter , Mrs. Richard Gibson Smith , Mrs. James S. Sudier 2 , and Mrs. Thomas Welborn .","Members of the committee include mrs. milton bernet , mrs. j. clinton bowman , mrs. rollie w. bradford , mrs. samuel butler jr. , mrs. donald carr campbell , mrs. douglas carruthers , mrs. john c. davis 3 , , mrs. cris dobbins , mrs. william e. ***** , mrs. alfred hicks 2 , , mrs. donald magarrell , mrs. willett moore , mrs. myron neusteter , mrs. richard gibson smith , mrs. james s. sudier 2 , and mrs. thomas welborn .",Be careful with the glass cup.,Be careful with the ***** cup.
deduce,3_science_LS1,a anaes s examples of deduce the properties of solids,A anaes s examples of ****** the properties of solids,"There he'd take a compass reading , figure his air speed , and deduce that in a certain number of minutes he'd be over the broad meadows of the Merrimack Valley where it would be safe to let down through the overcast and see the ground before it hit him .","There he'd take a compass reading , figure his air speed , and ****** that in a certain number of minutes he'd be over the broad meadows of the merrimack valley where it would be safe to let down through the overcast and see the ground before it hit him .", We deduce the answer from clues., we ****** the answer from clues.
cloth,3_science_LS1,covered by coloured pieces of cloth,Covered by coloured pieces of *****,"The prize was an old-fashioned , woven cloth hammock , complete with cross-top pillow , fringed side pieces , and hooks for hanging .","The prize was an old-fashioned , woven ***** hammock , complete with cross-top pillow , fringed side pieces , and hooks for hanging .",I dry my hands with a cloth.,I dry my hands with a *****.
along,3_science_LS1,tcomprisesarich suite of digital interactivities along withacomprehensive learning platform with,Tcomprisesarich suite of digital interactivities ***** withacomprehensive learning platform with,Congressional reaction to the message was along expected lines .,Congressional reaction to the message was ***** expected lines .,Come along to the store.,Come ***** to the store.
role,3_science_LS1,the heart plays an important role in the body,The heart plays an important **** in the body,This was disclosed today by a responsible source amid intensified efforts by the Soviet Union to gain a greater role in the staff and operation of the United Nations .,This was disclosed today by a responsible source amid intensified efforts by the soviet union to gain a greater **** in the staff and operation of the united nations .,She played the role of a nurse.,She played the **** of a nurse.
hear,3_science_LS1,things ears help us to hear around us,Things ears help us to **** around us,Dallas may get to hear a debate on horse race parimutuels soon between Reps. V. E. ( Red ) Berry and Joe Ratcliff .,Dallas may get to **** a debate on horse race parimutuels soon between reps. v. e. ( red ) berry and joe ratcliff .,Did you hear that noise?,Did you **** that noise?
contact,3_science_LS1,known to live in dose contact with human deings instead,Known to live in dose ******* with human deings instead,`` Surveys show that one out of three Americans has vital contact with the church .,`` surveys show that one out of three americans has vital ******* with the church .,Keep in contact with your friends.,Keep in ******* with your friends.
peed,3_science_LS1,tahaaste anne parnatinee can aatily peed pieetetiony organs and maka,Tahaaste anne parnatinee can aatily **** pieetetiony organs and maka,"May I say that you have just demonstrated the truth of an old proverb -- the younger Pliny's , if memory serves me -- which , translated freely from the archaic Latin , says , ' The more haste , the less peed ' '' .","May i say that you have just demonstrated the truth of an old proverb -- the younger pliny's , if memory serves me -- which , translated freely from the archaic latin , says , ' the more haste , the less **** ' '' .", The dog peed on the tree., the dog **** on the tree.
in,3_science_LS1,to all the stakeholders involved in the journey of education,To all the stakeholders **volved ** the journey of education,"The jury further said in term-end presentments that the City Executive Committee , which had over-all charge of the election , `` deserves the praise and thanks of the City of Atlanta '' for the manner in which the election was conducted .","The jury further said ** term-end presentments that the city executive committee , which had over-all charge of the election , `` deserves the praise and thanks of the city of atlanta '' for the manner ** which the election was conducted .",The cat is in the box.,The cat is ** the box.
removal,3_science_LS1,help in the veal bladde removal of waste from the,Help in the veal bladde ******* of waste from the,He declared on March 25 that the United States had erred a year and a half ago by `` encouraging the removal '' of Prince Souvanna .,He declared on march 25 that the united states had erred a year and a half ago by `` encouraging the ******* '' of prince souvanna .,The removal of shoes is required.,The ******* of shoes is required.
lucid,3_science_LS1,x6 concepts 9 explained in lucid language supported with accurate,X6 concepts 9 explained in ***** language supported with accurate,"Their collaboration in the Beethoven Second Symphony was lucid , intelligent and natural sounding .","Their collaboration in the beethoven second symphony was ***** , intelligent and natural sounding .", His explanation was clear and lucid., his explanation was clear and *****.
pen,3_science_LS1,ah fara wath 4 gamarind pen ey sae refer to,Ah fara wath 4 gamarind *** ey sae refer to,"Last two to be added before the book went to press were the marriages of Meredith Jane Cooper , daughter of the Grant B. Coopers , to Robert Knox Worrell , and of Mary Alice Ghormley to Willard Pen Tudor .","Last two to be added before the book went to press were the marriages of meredith jane cooper , daughter of the grant b. coopers , to robert knox worrell , and of mary alice ghormley to willard *** tudor .",Write with a black pen.,Write with a black ***.
